{
  "schema": 2,
  "generatedAt": "2026-07-27T04:51:10.744Z",
  "sourceRevision": "235efc034619c1e656598734fae14f8da68af630",
  "registryHash": "95a525beab325def36bf9fa5ec776055ad14fe1eb076eefa70a24eb684c279d1",
  "tally": {
    "conformant": 75,
    "partial": 12,
    "off_template": 5,
    "thin": 4,
    "missing": 0
  },
  "features": [
    {
      "slug": "task-management",
      "cohort": "ranked",
      "coverage": 90,
      "readiness": 43,
      "presentSections": 45,
      "expectedSections": 50,
      "readinessVerdict": "structurally_complete_unreviewed",
      "adversarialReview": "absent",
      "openDecisionCount": 2,
      "blockerCount": 12,
      "tbdCount": 11,
      "emptySectionCount": 0,
      "statusAlignment": "matched",
      "sourceHash": "c8fe64e61633506f0eb76ea7071bd1e04295025d31800a00582e6b20338a70ce",
      "docs": [
        {
          "key": "readme",
          "status": "conformant",
          "present": 7,
          "expected": 7,
          "actual": 8,
          "missingCount": 0
        },
        {
          "key": "product_spec",
          "status": "conformant",
          "present": 12,
          "expected": 14,
          "actual": 13,
          "missingCount": 2
        },
        {
          "key": "subfeatures",
          "status": "conformant",
          "present": 3,
          "expected": 3,
          "actual": 3,
          "missingCount": 0
        },
        {
          "key": "progress",
          "status": "partial",
          "present": 4,
          "expected": 5,
          "actual": 5,
          "missingCount": 1
        },
        {
          "key": "expected_outcomes",
          "status": "conformant",
          "present": 2,
          "expected": 2,
          "actual": 7,
          "missingCount": 0
        },
        {
          "key": "version_map",
          "status": "conformant",
          "present": 2,
          "expected": 2,
          "actual": 4,
          "missingCount": 0
        },
        {
          "key": "data_model_adr",
          "status": "partial",
          "present": 7,
          "expected": 9,
          "actual": 20,
          "missingCount": 2
        },
        {
          "key": "ux_adr",
          "status": "conformant",
          "present": 8,
          "expected": 8,
          "actual": 9,
          "missingCount": 0
        }
      ],
      "judgmentState": "never_verified"
    },
    {
      "slug": "calendar",
      "cohort": "ranked",
      "coverage": 100,
      "readiness": 48,
      "presentSections": 50,
      "expectedSections": 50,
      "readinessVerdict": "structurally_complete_unreviewed",
      "adversarialReview": "absent",
      "openDecisionCount": 4,
      "blockerCount": 7,
      "tbdCount": 13,
      "emptySectionCount": 0,
      "statusAlignment": "matched",
      "sourceHash": "f5940b68f4b4c363cade85aef469a0ea35906ec23cfc0b3028ecdfe11ade6289",
      "docs": [
        {
          "key": "readme",
          "status": "conformant",
          "present": 7,
          "expected": 7,
          "actual": 9,
          "missingCount": 0
        },
        {
          "key": "product_spec",
          "status": "conformant",
          "present": 14,
          "expected": 14,
          "actual": 14,
          "missingCount": 0
        },
        {
          "key": "subfeatures",
          "status": "conformant",
          "present": 3,
          "expected": 3,
          "actual": 3,
          "missingCount": 0
        },
        {
          "key": "progress",
          "status": "conformant",
          "present": 5,
          "expected": 5,
          "actual": 6,
          "missingCount": 0
        },
        {
          "key": "expected_outcomes",
          "status": "conformant",
          "present": 2,
          "expected": 2,
          "actual": 2,
          "missingCount": 0
        },
        {
          "key": "version_map",
          "status": "conformant",
          "present": 2,
          "expected": 2,
          "actual": 2,
          "missingCount": 0
        },
        {
          "key": "data_model_adr",
          "status": "conformant",
          "present": 9,
          "expected": 9,
          "actual": 9,
          "missingCount": 0
        },
        {
          "key": "ux_adr",
          "status": "conformant",
          "present": 8,
          "expected": 8,
          "actual": 9,
          "missingCount": 0
        }
      ],
      "judgmentState": "never_verified"
    },
    {
      "slug": "self-evaluation",
      "cohort": "ranked",
      "coverage": 40,
      "readiness": 39,
      "presentSections": 20,
      "expectedSections": 50,
      "readinessVerdict": "reviewed_gaps_remain",
      "adversarialReview": "present",
      "openDecisionCount": 0,
      "blockerCount": 0,
      "tbdCount": 3,
      "emptySectionCount": 0,
      "statusAlignment": "matched",
      "sourceHash": "6febb246e325c2656829e26dae3522805c32c0d08e724d95c228a438c6514e3b",
      "docs": [
        {
          "key": "readme",
          "status": "partial",
          "present": 5,
          "expected": 7,
          "actual": 8,
          "missingCount": 2
        },
        {
          "key": "product_spec",
          "status": "partial",
          "present": 9,
          "expected": 14,
          "actual": 11,
          "missingCount": 5
        },
        {
          "key": "subfeatures",
          "status": "thin",
          "present": 0,
          "expected": 3,
          "actual": 0,
          "missingCount": 3
        },
        {
          "key": "progress",
          "status": "off_template",
          "present": 0,
          "expected": 5,
          "actual": 5,
          "missingCount": 5
        },
        {
          "key": "expected_outcomes",
          "status": "conformant",
          "present": 2,
          "expected": 2,
          "actual": 2,
          "missingCount": 0
        },
        {
          "key": "version_map",
          "status": "off_template",
          "present": 0,
          "expected": 2,
          "actual": 3,
          "missingCount": 2
        },
        {
          "key": "data_model_adr",
          "status": "partial",
          "present": 1,
          "expected": 9,
          "actual": 6,
          "missingCount": 8
        },
        {
          "key": "ux_adr",
          "status": "partial",
          "present": 3,
          "expected": 8,
          "actual": 9,
          "missingCount": 5
        }
      ],
      "judgmentState": "current",
      "judgment": {
        "score": 58,
        "verdict": "drafting",
        "reviewed": "2026-07-26",
        "reportHash": "7ae098b47fbaee09f7c8dffc8c3a9209b3c420824567df5693c75b9f1cc82a9e",
        "sourceHashAtReview": "6febb246e325c2656829e26dae3522805c32c0d08e724d95c228a438c6514e3b"
      }
    },
    {
      "slug": "analytics",
      "cohort": "ranked",
      "coverage": 62,
      "readiness": 45,
      "presentSections": 31,
      "expectedSections": 50,
      "readinessVerdict": "reviewed_gaps_remain",
      "adversarialReview": "present",
      "openDecisionCount": 0,
      "blockerCount": 13,
      "tbdCount": 8,
      "emptySectionCount": 0,
      "statusAlignment": "matched",
      "sourceHash": "b6b914c56da52a8f733645e1699776c0b5e5ae0e00fd709ffd61307556516bb9",
      "docs": [
        {
          "key": "readme",
          "status": "conformant",
          "present": 6,
          "expected": 7,
          "actual": 8,
          "missingCount": 1
        },
        {
          "key": "product_spec",
          "status": "partial",
          "present": 9,
          "expected": 14,
          "actual": 9,
          "missingCount": 5
        },
        {
          "key": "subfeatures",
          "status": "conformant",
          "present": 3,
          "expected": 3,
          "actual": 3,
          "missingCount": 0
        },
        {
          "key": "progress",
          "status": "conformant",
          "present": 5,
          "expected": 5,
          "actual": 5,
          "missingCount": 0
        },
        {
          "key": "expected_outcomes",
          "status": "conformant",
          "present": 2,
          "expected": 2,
          "actual": 2,
          "missingCount": 0
        },
        {
          "key": "version_map",
          "status": "conformant",
          "present": 2,
          "expected": 2,
          "actual": 2,
          "missingCount": 0
        },
        {
          "key": "data_model_adr",
          "status": "thin",
          "present": 2,
          "expected": 9,
          "actual": 3,
          "missingCount": 7
        },
        {
          "key": "ux_adr",
          "status": "thin",
          "present": 2,
          "expected": 8,
          "actual": 2,
          "missingCount": 6
        }
      ],
      "judgmentState": "never_verified"
    },
    {
      "slug": "roles-and-permissions",
      "cohort": "ranked",
      "coverage": 82,
      "readiness": 27,
      "presentSections": 41,
      "expectedSections": 50,
      "readinessVerdict": "drafting_substantial_unreviewed",
      "adversarialReview": "absent",
      "openDecisionCount": 2,
      "blockerCount": 13,
      "tbdCount": 18,
      "emptySectionCount": 0,
      "statusAlignment": "mismatched",
      "sourceHash": "4687ff45121d0eb8091b39e8140d82aa359f65d8426637cf801c79bea023a10e",
      "docs": [
        {
          "key": "readme",
          "status": "conformant",
          "present": 7,
          "expected": 7,
          "actual": 8,
          "missingCount": 0
        },
        {
          "key": "product_spec",
          "status": "conformant",
          "present": 14,
          "expected": 14,
          "actual": 14,
          "missingCount": 0
        },
        {
          "key": "subfeatures",
          "status": "conformant",
          "present": 3,
          "expected": 3,
          "actual": 3,
          "missingCount": 0
        },
        {
          "key": "progress",
          "status": "conformant",